Job Title,Job Category,Company Name,Salary,Requirements
Project Manager (Coal Mining),Full time,PT. KTC COAL MINING & ENERGY,,"Usia minimal 40 tahun.Lulusan S1 (Sarjana) bidang Pertambangan, Geologi, Sipil dan Teknik dari universitas/fakultas yang terakreditasi.Pengalaman minimal 10 tahun pada posisi yang sama (diutamakan dari kontraktor pertambangan).Mampu mengoperasikan mining software dan MS Office.Mampu melakukan analisis dan simulasi perhitungan secara detailMemiliki kapabilitas dalam melakukan multi-tasking (managerial, engineering, budgeting, costing, planning, directing, monitoring, controlling, organizing, problem-solving, managing people, reporting dan lain-lain).Memahami berbagai faktor eksternal yang dapat mempengaruhi keberlangsungan operasi penambangan.Memiliki leadership yang kuat serta mampu bekerja dibawah tekanan.Mampu berbahasa Inggris (lisan dan tulisan).Memiliki sertifikasi POM.Bersedia ditempatkan diseluruh site project (remote area)."
Accountant (remotely),Full time,PT. MATCH MAKERS AGENCY,Rp 5.000.000 – Rp 6.000.000 per month,Not Found
Public Affair/Government Relations Expert,Contract/Temp,ASIA PULP AND PAPER,,Not Found
Supervision,Full time,PT Daikin Airconditioning Indonesia,Rp 9.500.000 – Rp 10.700.000 per month,"Diploma/ Bachelor Degree From EngineeringGood ability on Microsoft Office,Detail oriented, fast-learner, and team playerGood English Communication Skill"
Project Controller (Mobile - Roster Schedule),Full time,Aden Services – Indonesia,,">Pendidikan terakhir minimal Diploma.
>Memiliki pengalaman bekerja di Bidang F&B minimal 2 Tahun.
>Memiliki pengalaman dengan Sistem ERP, SAP, Navision lebih diutamakan.
>Familiar dengan Ms. Office (khususnya Ms. Excel)
>Bersedia bekerja mobile (ke area Remote Site)."
Sales Engineer,Full time,PT Halley & Mellowes Australasia,,"Bachelor’s degree in engineering Major.Experience in sales with one or more in Electrical and Instrumentation.Excellent verbal and written communication skills both in Bahasa Indonesia and EnglishHigh level of computer literacyAbility to build rapport and develop relationships with internal and external customers and prospectswell organised and a proven chaser of business opportunitiesBe (Both) technically and sales orientatedCustomer focussed with attention to detailsBudget forecasting and proficiency with commercial terms and conditionsAbility and willingness to travel is a MUST
A solid understanding of engineering and technical principles is required along with the ability to effectively communicate details and objectives within project teams, sub-contractors and clients. We are looking for a strong achiever who strive for results and are passionate about developing their expertise and building a successful career. We want people who are professional, innovative, committed and looking to be challenged.
In return for your hard work and dedication you will be remunerated with a competitive salary package with the opportunity to be part of rapidly growing mining infrastructure projects. You will work with a team of driven and professional colleagues who encourage support and delivering optimum results."
Web Designer,Full time,Private Advertiser,,"- Proven experience in website design and development, specifically on the Squarespace platform.
- Strong portfolio showcasing previous Squarespace projects, including responsive and functional websites.
- Knowledge of best practices for web design, UX/UI principles, and SEO.
- Proficiency in using design tools such as Adobe Creative Suite, Figma, or similar.
- Excellent communication skills, both verbal and written.
- Ability to work independently and manage time effectively to meet deadlines."
Assistant - Plantation - Penempatan Kalimantan Timur (Sepaku),Full time,PT Agro Harapan Lestari,,Candidate must possess at least Bachelor's Degree in Agriculture/Aquaculture/Forestry or equivalent.At least 2 Year(s) of working experience in the related field is required for this position.Preferably Staff (non-management & non-supervisor) specialized in Agriculture/Forestry/Fisheries or equivalent.Placement in East Kalimantan site (Sepaku - Paser Penajam Utara)Willing to work in remote area/location
Graphic Designer Jakarta (Freelance Part Time),Part time,Zhuan Marketing Agency Indonesia,Rp 1.000.000 per month,"Mahir menggunakan Canva, mampu memanfaatkan template dengan baik tanpa harus mulai dari nol setiap saat.Fast response: siap memberikan respons cepat untuk setiap revisi atau request.Pengalaman membuat desain yang menarik dan kreatif untuk media sosial.Siap mendesain sekitar 50 feed per bulan untuk satu brand, fokus pada kualitas dan konsistensi visual."
Chief Geologist,Full time,PT. KTC COAL MINING & ENERGY,,Not Found
IT Firewall (Full WFH),Contract/Temp,PT Sinergi Wahana Gemilang,,Not Found
Drill & Blast Engineer,Full time,PT Maruwai Coal,,Not Found
VMWare Engineer,Contract/Temp,"PT. Metrodata Electronics, Tbk",,Not Found
Mechanic/Electrical Mechanic rig,Full time,PT. OMEGA DRILLING SERVICES,,Not Found
Communication Specialist,Full time,PT Pulau Sambu,,Not Found
Sales Engineer,Full time,PT Tekno Fluida Indonesia,,"Age Maximum 38 years old.Minimum Education S1 Degree in Mechanical Engineering / Industrial Engineering.Minimum Experience 2 years in marketing industrial field.Well-rounded mechanical aptitude and familiar with Hydraulic, Filtration, and Wastewater Treatment.Well-rounded mechanical aptitude and familiar with pumps, motor, valves, flanges, seals, piping, tanks, sensors, instrumentation, control systems, process and instrumentation diagrams (P&Ids), and process flow diagrams (PFDs).Good skill in computer literate.Proficient in English both written and speaking.Having Driver License (SIM A and C).Able to work under minimum supervision and under pressure.Strong analytical sense.Able to create reports.Willing to work on remote area.Will be working in BSD, Tangerang Selatan.
If you feel that you can meet the qualification and up to the challenge, feel free to apply by pressing the underneath button."
Maintenance Planning Engineer (CHPP),Full time,PT Maruwai Coal,,Not Found
Network Engineer,Full time,Jasnikom Gemanusa,,"Bachelor's Degree in Engineering (Computer/Telecommunication/Network), Computer Science/Information Technology or equivalentHave a Cisco Certificate such as CCNAWilling to be placed in offshore and remote areaHaving a healthy body and healthy eyesWilling to work in elevation areaAble to work individually or team and in under pressure situationHave the ability to analyze technical problems, draw conclusions and provide recommendations / proposed the solutions.Having knowledge about HSEFluent in English is a must"
Affiliate Specialist (Internship),Casual/Vacation,PT Interbat,,Not Found
Checkout Services Manager (Alam Sutera),Full time,IKEA Indonesia,,Not Found
Technical Control Officer,Full time,PT Royal Lestari Utama (Michelin Group),,Not Found
Sales Executive,Full time,Sava Catering,Rp 2.000.000 – Rp 3.000.000 per month,Not Found
Lead Tender & Project Sourcing,Full time,General Electric International Operations Co.inc,,Not Found
Finance Associate,Full time,CFO Assist Pte. Ltd.,"Rp 14,000,000 – Rp 21,000,000 per month",Not Found
Marketing & Business Development Senior Manager,Full time,Private Advertiser,,Not Found
Operation & Maintenance Technician,Full time,Jasnikom Gemanusa,,"Pendidikan minimal SMK Elektro / Telekomunikasi / InformatikaBerbadan sehat dan lulus MCUBersedia bekerja secara shiftJika diperlukan, bersedia ditempatkan dan/atau bisa ditugaskan ke luar kota, baik onshore, offshore ataupun remote areaPengalaman kerja minimal 1 tahun di bidang Radio Microwave, atau VSAT, atau NetworkingMempunyai sikap kerja dan kemampuan komunikasi yang baikMampu bekerja dibawah tekanan dan target yang ketatMampu bekerja secara mandiri maupun dalam teamUlet & cekatan dalam bekerjaMemiliki integritas dan motivasi kerja yang tinggiMampu mengoperasikan aplikasi MS office (Excel, Word, Power Point, Visio)Mengerti bahasa InggrisMemiliki kepedulian terhadap kesehatan dan keselamatan kerja"
Project Portfolio Analyst,Part time,PT Suitmedia Kreasi Indonesia,,"Bachelor’s degree in Information System, Information Technology, or related field.1-2 years of experience in project management, data analysis, or a related role (internship experience considered).Strong analytical skills with proficiency in Google Sheets, or other data analysis tools.Familiarity with project management software (e.g. Jira, Basecamp, or Teamwork) is a plus.Excellent communication and interpersonal skills, with the ability to convey data-driven insights to non-technical stakeholders.Strong organizational skills and attention to detail, with the ability to prioritize tasks effectively.
We apply remote-first approach or WFA (Work From Anywhere) as our work nature to enhance work-life balance."
Field Engineer,Full time,PT Navita Origo Solution,,Not Found
Indonesian VA - Link Building Assistant,Full time,REBEL Internet BV,$1.25 per hour (USD),"Minimum of 2 years of experience working online in SEO or a related field.
Proficient in English, with excellent written communication skills.
Familiarity with Trello.
Strong attention to detail and ability to follow instructions."
Shop Keeper,Part time,Propotype RC (CV Hala Kreatif Indonesia),,Not Found
Outbound Sales Representative,Full time,Fausto Automation,"Rp 3,500,000 per month","* At least 1 year of sales experience, cold-calling experience is a plus.
* Excellent communication skills in English, both written and verbal.
* Results-driven with a track record of performing well in high-paced, goal-oriented environments.
* Experience with CRM tools is a plus."
SAP  ABAP,Full time,PT. SIGMA GLOBAL TEKNOLOGI (SIGMATECH),,Not Found
Service Delivery Field Support Engineer (L1),Full time,PT NTT Indonesia,,Not Found
Reservation Admin,Full time,FINNS Recreation Club,,"• Minimum 1-2 Years' experience in reservations, data entry, or related area experience.
• Fluent in English written & Spoken
• Good numeracy skills
• Team player with
• Good understanding of reservations
• Familiar with OTAs. B2B. Extranet
• High attention to detail
• All work is conducted in English
Tersedia jam fleksibelDiperlukan 1 tahun pengalaman kerja yang relevan untuk posisi iniPelamar harus memiliki KTP"
Inventory Planning Analyst,Full time,The Ridge,,"Proven experience in inventory management, data analysis, or a similar role.Proficiency in Excel and experience with data analysis tools (e.g., SQL, Tableau, or similar).Strong analytical skills with a keen attention to detail.Excellent communication and interpersonal skills.Ability to work collaboratively in a fast-paced environment.
Preferred Qualifications:
Experience with ERP systems, preferredFamiliarity with inventory optimization techniques."
admin,Full time,Private Advertiser,Rp 2.000.000 – Rp 3.000.000 per month,•Language Skills:Excellent written and spoken English is essential. You should be able to write fluently and confidently to match the platform’s professional and engaging tone.
Fullstack Developer Golang,Full time,Vascomm,,Not Found
Staff Techonology IT.,Full time,PT Biota Laut Ganggang (Pinrang),Rp 3.434.298 – Rp 5.151.447 per month,"Pendidikan minimal S1 dalam bidang Komputer, Jaringan, atau TelekomunikasiPengalaman kerja terkait minimal 1 tahun, mampu menggunakan bahasa Inggris dasar untuk komunikasi harian dan tulisanMemiliki pengalaman dalam implementasi proyek jaringan dan mampu menyelesaikan perubahan dan pemeliharaan jaringan secara mandiri adalah nilai tambahMenguasai produk jaringan dari Mikrotik, Cisco, UBNT, dan mampu mengonfigurasi serta menguji router, switch, firewall, dan produk jaringan lainnyaJujur dan dapat dipercaya, ramah, memiliki sikap positif, bekerja dengan serius dan bertanggung jawab, memiliki semangat kerja keras, inisiatif tinggi dalam melayani, serta kemampuan teknis yang baikMemahami metode analisis diagnosis masalah/kerusakan/potensi risiko jaringan, serta metode optimalisasi kinerja dan kualitas jaringanMemiliki pengetahuan dasar tentang listrik lemah dan pengalaman kerja terkaitMemahami teknik penanganan masalah sehari-hari untuk sistem akses kontrol dan pengawasan videoMenguasai perangkat keras dan perangkat lunak komputer serta perangkat IT kantor lainnya"
IT Security,Full time,Vascomm,,Not Found
Lowongan Kerja sebagai Junior GIS Specialist di Minerva Ventures Penempatan,Full time,Minerva Ventures Indonesia,,Not Found
Recruitment Specialist (Immediate 1 month contract),Full time,Snaphunt,,"Prior experience in Sales, recruitment, staffing, or talent acquisition is preferred.Strong goal orientation with the ability to meet deadlines and deliver results in a dynamic environment.Excellent communication and interpersonal skills, with the ability to influence and engage candidates effectively.Strong organizational skills and attention to detail.A proactive approach to learning and adapting in a fast-paced environment."
Senior IT Manager,Full time,Private Advertiser,,"Bachelor’s degree in information technology, computer science, software engineering, or a related field.Required language(s): Bahasa Indonesia, English.At least 5 Years) of working experience in the related field is required for this position.Proven experience managing IT infrastructure and services.Experience with computer networks, network administration, and network installation.Experience with database administration, Mysql, MSSQL, PostgreSQL, and Amazon RDS.Proficient in computer hardware, cabling installation and support, wireless technology applications and interfaces, and IT security.Management and leadership skills.Multi-tasking and time-management skills, with the ability to prioritize tasks.Highly organized and detail-oriented.Excellent analytical and problem-solving skills.Flexible working hours."
"Manager, Business Development",Full time,Intraco Limited,,Personal Requirements:
System Analyst (.NET),Full time,PT Linov Roket Prestasi,,"Bachelor Degree in IT/ Computer Science, or related field.Having experience in System Analyst for about 3 years.Having experience in System Development (technical) for about 3 years.Understand SDLC (waterfall methodology). Knowledge in agile will be advantageous.Ability to work with a cross functional team and diverse culture.Excellent communication skillAble to communicate in English. Ability to understand English conversation and document is a must.Willing to be assigned to work full onsite (WFO). But also self-motivated during remote / WFH environment.Critical thinking and eager to challengeGood issue, task and time managementAble to work under high pressure and target
Technical Skill:
Hands on experience in ASP .NET C# developmentDatabase design and programming (SQL)Webservice, XML & JSONKnowledge in various state-of-the-art technologyREST APISystem Design CreationAbility to translate biz requirement to use case and system functional flow (UML Diagram)JIRA/ MS. PLANNER, postman, UML Diagram, system architecture diagramAble to conduct system analysis based on requirement and document the result properlyHave experience in the process of making microservice and monolith application related to requirements, design, development, testing and documentation
Optional/Preferable skill:
Knowledge in JSONExperience in java script frameworksK2 WorkflowExperience in Banking or Financial IndustryMicroserviceDevops (experience using Jenkins is advantageous)DevExpressHaving knowledge on container platform, such as docker, openshift and kubernetes is a plusHaving experience to setting CI/CD pipeline using Jenkins or Gitlab CI is a plusHaving knowledge on agile methodology, conduct in teams meetings (with all Agile Ceremonies: DSM,Planning, review and retro) to provide input from business analyst and delegate solutions to dev team to improve efficiency.Work closely with development team to support analyzation including create API design microservices and all documentations"
Video Editor (Offshore),Contract/Temp,PropNex Realty Pte Ltd,$600 – $900 per month (SGD),Not Found
Second Level Maintenance (SLM) - Managed Service,Contract/Temp,PT Brinks Solutions Indonesia,Rp 5.000.000 – Rp 5.100.000 per month,Not Found
IT Support,Contract/Temp,PT. Bali Ria Internasional,Rp 3.500.000 – Rp 4.500.000 per month,Not Found
Sales Manager,Full time,Private Advertiser,,Not Found
SUPERINTENDENT DEVELOPMENT FACILITIES,Full time,PT Amman Mineral Nusa Tenggara,,"Bachelor Civil / Architect engineering with 15-18 years’ experience in Project management Development Facilities, including Urban Spatial Planning for townsites in mining or heavy industries. This scope covers key planning, development, and sustainability aspects to ensure that the town is not only functional for workers and their families but also environmentally and economically sustainable.Has minimum 5 years’ experience as Head / Superintendent Business Development FacilitiesAn advanced degree or relevant certifications (e.g., Project Management Professional - PMP) is advantageous; Proficient in project management tools (e.g., MS Project, Primavera) and familiar with engineering and construction principles.Strong understanding of mining industry regulations, particularly in safety, environmental, and infrastructure standards.
Have middle level operational inspector certificate (POM) or qualifications certificate recognized by (Chief Mines Inspector) in accordance with level of position.
Strong leadership and organizational, scheduling & time management skills; Ability to work both independently and as a team player and thrive in a fast paced, high pressure environment dependent on managing multiple project timelines and schedules simultaneously; Ability to communicate well, and work productively with internal and external individuals; A commitment to safety and a desire to maintain our Indonesian mining operations to world class international safety standards; Demonstrate strong conceptual skills, and capable of developing lateral and practical solutions; High level of integrity and commitment; Good analytical, conflict resolution, sound decision making skills;Excellent communication skills in English both verbal and written and computer literate."
Ahli Kepabeanan,Full time,PT Pulau Sambu,,Not Found
SEO Content Writer,Contract/Temp,PT Ninety Nine Dotco,,Not Found
"Software Engineer, Mobile (Flutter) - Merchant Experience",Full time,PT Solusi Transportasi Indonesia,,Not Found
Field Sourcing Supervisor - Rice & Rice Bran,Full time,PT Jiva Agriculture Indonesia,,"Bachelor’s degree in Agriculture, Supply Chain Management, Business Administration, or related field.Minimum of 3-5 years of experience in procurement, preferably in the agricultural or commodity sector, especially paddy.Having experience as a team leader is preferred.Strong knowledge of the rice industry, including types of rice and rice milling processes.Able to communicate in English - written & spoken (mandatory)Owning motorcycle and SIM C"
Inside Sales Representative,Full time,PT Schneider Electric,,Not Found
PayPal Disputes Agent,Full time,GTEcom BV,,Not Found
Fractional Advisor – Fintech,Part time,Snaphunt,,Not Found
Associate Video Editor,Contract/Temp,FullFind,,"2-3 years experience as a Video Editor, with a strong portfolio demonstrating expertise in both long-form and short-form video content.Proficiency in video editing software such as Adobe Premiere Pro, Final Cut Pro, or similar tools.Ability to conceptualize and execute creative ideas effectively.Excellent organizational and time-management skills to handle multiple projects simultaneously and meet deadlines."
Account Manager - Bioprocess and Genomic Medicine,Full time,Danaher Corporation,,Not Found
IT Support,Full time,PT Innoark Servis Internasional,,"Good command of English is a must.
Educational background in IT software is required.
Knowledge of support framework best practices.
Minimum of 2 years of experience in a technical customer support or application customer support role, preferably in a software or technology company.
Strong technical aptitude and troubleshooting skills, with the ability to analyze and solve complex technical problems.
Excellent communication skills, both written and verbal, with the ability to communicate technical information to non-technical users effectively.
Ability to work independently and collaboratively in a fast-paced environment.
Proficiency in using SQL commands.
Proficiency in using a ticketing system such as Zendesk will be an advantage.
Ability to communicate (verbally and in writing) with Mandarin-speaking clients will be an advantage.
Willingness to work overtime when necessary."
"Community & Partnerships Coordinator (Ubud, Full-Time)",Full time,Outpost,,Not Found
Graphic and UI/UX Designer,Full time,Snaphunt,,"Experience in exhibition design or similar deadline-driven projects.Previous experience in UI/UX design or website development.
The Employer
Our client is a dynamic company committed to delivering innovative solutions across diverse industries. Their vision is to lead globally by creating impactful solutions, while their mission is to provide exceptional value through expertise, collaboration, and creativity. They offer various services, including custom software solutions, cutting-edge technology, consulting, project management, and quality assurance. Their strengths lie in innovation, expertise, customer-centricity, and integrity. Join them to transform challenges into opportunities and drive growth together."
Partner Engagement Supervisor,Full time,PT Paragon Pratama Teknologi,,Minimum of 5 years of relevant experiencePrior experience as a Junior Manager in a relevant roleExcellent communication & delegation skill is a mustFlexible in remote placing all over Indonesia [If there is a project]Proven experience in establishing and managing partnershipsProficiency in Microsoft OfficeStrong project management skill is a plus point
Graphic and UI/UX Designer,Full time,PLS Pte Ltd,,"Experience in exhibition design or similar deadline-driven projects.Previous experience in UI/UX design or website development.
What's on Offer?
Opportunities for Learning and GrowthWork From HomePerformance Bonus"
Sales Specialist,Part time,Snaphunt,,Not Found
Chief Engineering24185349,Full time,The Laguna a Luxury Collection Resort & Spa Nusa Dua Bali,,Not Found
Data Annotator - Freelance,Full time,Mindrift,,"Our ideal candidate:
Has great command of English: advanced (C1) / proficiency (C2) / native level.Has a keen eye for detail: precision is paramount in data labeling.Is a dedicated performer who recognizes the importance of even routine tasks."
Data Annotation Specialist - Freelance,Full time,Mindrift,,"Our ideal candidate:
Has great command of English: advanced (C1) / proficiency (C2) / native level.Has a keen eye for detail: precision is paramount in data labeling.Is a dedicated performer who recognizes the importance of even routine tasks."
SEA - Recruitment Freelancer,Full time,Qode,,Not Found
Assistant Spa Manager24172151,Full time,TA AKTANA a Luxury Collection Resort & Spa Labuan Bajo,,Not Found
Developer ERP Odoo,Full time,Vascomm,,Not Found
Konsultan Fungsional ERP Odoo,Full time,Vascomm,,Not Found
Social Media Manager (Marketing),Full time,Fans-CRM,,Not Found
Mobile App Developer,Part time,Snaphunt,,"●       You possess a Degree/Diploma in Computer Science, Engineering or related field.
●       You have at least 3 years experience, ideally within a Software Engineer role.
●       Proven experience with Flutter, React, or other cross-platform mobile development platform.
●       Expertise in Swift for iOS and Kotlin/Java for Android development.
●       Strong understanding of Mobile UI/UX Design and the ability to create user-friendly interfaces.
●       Experience with app deployment processes on App Store and Google Play.
●       Familiarity with mobile app performance optimization techniques.
●       Experience working in a fast-paced startup environment is a plus.
●       Strong problem-solving skills and ability to collaborate with a remote, global team.
The Employer
Our client is redefining professional networking for purpose-driven leaders by creating a global community where corporates, institutions, and individuals collaborate to streamline the fragmented CSR and social impact sector. They aim to build a transparent, efficient, and execution-driven ecosystem that sustains itself and delivers real-world impact through socially and philanthropically aligned initiatives."
Consultant - Platform,Full time,PT Tech Data Advanced Solutions Indonesia,,Not Found
Outreach Manager / Sales Development Representative,Full time,Fans-CRM,,"Proficient written English (B2 level and above); additional languages are a plus to be able to effectively liaise with stakeholders in the region.Ability to use CRM systems.Systematic and hardworking approach.
Additional Qualifications:
Experience in a similar position.Desire for career growth.High level of personal culture.Basic understanding of the sales funnel."
Chief Steward24184045,Full time,The Sira a Luxury Collection Resort and Spa Lombok,,Not Found
Full Stack Developer,Part time,GTEcom BV,,Not Found
Search Engine Evaluator (WFH),Part time,Snaphunt,,"High-speed internet connectionPC with Windows or Mac OS X operating system and Google Chrome.Fluency in English; native-level fluency in your local language (Japan, South Korea, or Indonesia)Detail-oriented, deadline-driven, and reliable.Only one person per household participating.
The Employer
Our client is the world’s leading provider of technology-enabled language, content management and intellectual property services."
Project Manager (Active Pooling),Full time,FullFind,,Not Found
Technical Support Part-Time,Part time,Kataai,,Not Found
