Job Title,Job Category,Company Name,Salary,Requirements
Social Media Manager for Construction Company (US Based/Remote),Full time,Paired,,"Proven work experience as a Digital marketing strategist or Digital marketing managerDemonstrable experience with SEO/SEM and CRM softwareExperience implementing and optimizing Google Adwords campaignsSolid knowledge of web analytics tools like Google Analytics2+ years managing social media in a brand, agency, or exceptional personal account capacityVideo and photo editing skills, such as those using Canva and CapCut.Hands on experience with online marketing tools and practicesFamiliarity Instagram, You-tube, TikTok, reels, X, Facebook, etcFluent in professional English (Writing & Speaking)Strong analytical and project management skills"
HR Admin for CPA Firm (US Based/Remote),Full time,Paired,,"Associate's or Bachelor’s degree in Accounting, Business Administration, Human Resources, or a related field.Proven experience in an administrative or HR role, preferably in a CPA or financial services firm.Proficient in MS Office (Word, Excel, PowerPoint).Strong organizational and multitasking skills.Excellent verbal and written communication skills.Ability to maintain confidentiality and handle sensitive information.Detail-oriented and able to work independently as well as part of a team."
Content Creator (remote),Part time,Snaphunt,,"Good appearance in front of the camera.Fluent in English with no noticeable accent.Comfortable speaking in front of the camera; previous experience in video content creation is a plus.Strong communication skills and a lively, engaging personality.Understanding of financial markets is a plus
The Employer
Our client is looking for a highly motivated Content Creator for the financial team of a prop trading service provider. This role involves creating engaging and informative content about financial markets and trading strategies. The successful candidate will help educate our audience, contributing significantly to our market presence."
Senior Business Development (Mekari Qontak),Full time,PT Mid Solusi Nusantara (MEKARI),,"Preferably from a Bachelor Degree in Accountancy, Management, or equivalent, but Fresh Graduate is also welcomed.Minimum of 3 years of sales experienceProven track record in achieving sales quotaB2B sales experience is necessaryExperience in SaaS/Tech companies is a plus.Experienced in building and managing sales teamExcellent written and verbal communication skills.Comfortable and confident speaking to mid-level and senior executives.Strong organizational skills Strong interpersonal communication skills.Analytical, detail-oriented and results-focused Scrappy and competitive!Desire to drive results and improve every single day.Proficient with corporate productivity and with web presentation tools.Have a positive, can-do attitude, extraordinary hustle, disdain for failure, and hunger/appreciation for feedback.Have deep self-motivation and the ability to self-manage.Objective and Target-OrientedExcellent presentation skills"
Video Editor for DTC Brand (US Based/Remote),Full time,Paired,,"Previous experience as a Video Editor or a similar role, with a strong portfolio showcasing your editing skillsProficient in video editing software such as Adobe Premiere Pro, Final Cut Pro, or similar toolsExperience in working with direct-to-consumer (DTC) brands is preferredStrong knowledge of current video editing techniques and trendsExcellent attention to detail and ability to work under tight deadlinesStrong communication and collaboration skills to effectively work with cross-functional teamsUses TikTok / MetaExperience with capcut , premiere pro or Final Cut but preferably cap cutExperience working with English brand’s video ads on Facebook / InstagramDecent understanding of Facebook ads manager so we can clearly communicate results of editsCan provide video examples of edits made in the past (portfolio)Understands iterative testing for Facebook ads such as testing video hooks, bodies , headlines, etcFluent in English"
"KAM Indonesia and Vietnam Job - iGaming - Remote, Asia",Full time,"KAM Indonesia and Vietnam Job - iGaming - Remote, Asia",,Not Found
Malay To English Remote Telephone Video Interpreter Required,Full time,Recruitment Empire,,Not Found
Video Editor for a YouTube Channel (Remote),Full time,Paired,,"Proficiency in video editing software such as Adobe Premiere Pro, Final Cut Pro, or comparable alternatives.Excellent understanding of video production techniques, including editing, color grading, and visual effects.Ability to work independently and manage multiple projects simultaneously.Strong attention to detail and a commitment to producing high-quality work.Familiarity with YouTube optimization strategies and audience engagement tactics.Effective communication skills and the ability to collaborate with cross-functional teams."
Remote Motion Graphics Artist,Full time,Snaphunt,,Not Found
Crypto Business Development Specialist (Indonesia- Remote),Full time,Token Metrics,,Not Found
Remote Creative Quality Specialist,Full time,Snaphunt,,"Scrutinizes customers' requests efficiently to guarantee they adhere to the Design Pickle quality control standards. Our Quality Specialists handle multiple revisions, addressing each one individually with speed and precision.Maintain High Productivity and Efficiency. Our Quality Specialists are expected to review an average of 50 requests within an 8-hour shift.Examine customer’s concerns from a quality perspective and offer valuable recommendations and observations to enhance our quality outputs.Perform technical reviews and provide well-founded feedback to creatives on requests on creative requests within our scope of service, focusing on customer instructions, brand adherence, copy accuracy, and general industry standards. You will be reviewing the creative output, not managing a team of creatives.Adheres to established quality control procedures while utilizing Design Pickle Platform functionalities correctly.Collaborates closely with Quality Specialist teammates and Quality Coordinator to streamline the handling of the quality review queue efficiently.Remains well-informed about the latest updates and pertinent information concerning the creative review process, ensuring the enforcement of up-to-date procedures.Generates weekly reports pinpointing areas for improvement in overall aesthetics and creative quality of clients' requests.Actively offers feedback to the Quality Coordinator regarding Quality Team procedures, contributing to the ongoing enhancement of quality control processes.Proactively notifies the Quality Coordinator about any abnormal system behavior or potential bugs identified in the Design Pickle Platform.Such other services as the Client may require.
The Profile
Requirements
Proficient in reviewing designs and artworks within the scope of the client's services.Proficiency in tools such as Adobe Creative Cloud, including Photoshop, Illustrator, InDesign, After Effects, and Premiere Pro as well as other tools like Microsoft PowerPoint, Google Slides, Canva, and FigmaKeen attention to detail, ensuring precision in the review of creative output.Ability to identify and address quality issues in creative works, covering aesthetic and technical considerations.Capacity to effectively comprehend information, ensuring a thorough review of requests based on Make Relish's clients' details and ticket specifications.Robust analytical and problem-solving skills essential for maintaining quality standards.Experience and knowledge of the creative industry, coupled with a constant drive to stay informed on evolving industry trends.Effective communication skills, both written and oral, facilitating clear and concise interactions.Ability to work effectively with minimal supervision in order to reach team goals and metrics."
Project Manager for Marketing Agency (US Based/Remote),Full time,Paired,,"Bachelor's degree in Business, Marketing, Operations Management, or a related field.Minimum 3 years of experience in operations management, preferably within the marketing or advertising industry.Team leading experience is preferred.Demonstrated success in developing and implementing operational strategies to drive efficiency and productivity.Strong analytical and problem-solving skills.Excellent leadership and team management abilities.Exceptional communication and interpersonal skills.Proven ability to work independently and remotely."
Media Buying and Creative Lead For DTC Brand (US Based/Remote),Full time,Paired,,"5+ years of experience in a relevant role, preferably in an ecommerce or retail environment.Proven experience in leading and managing a creative team.Deep understanding of the e-commerce landscape, including digital marketing channels, online sales funnels, and key performance indicators (KPIs) for measuring campaign success.Proven track record of planning, executing, and optimizing digital media campaigns across multiple channels, including paid search, social media, display advertising, and programmatic.Proficiency in managing advertising campaigns on major digital advertising platforms, such as Google Ads, Meta, Tiktok, Facebook Ads, Instagram Ads, etc.Strong portfolio showcasing your creative work across various platforms and mediums.Understanding of branding principles and ability to develop and maintain brand guidelines.Strong conceptual thinking and ability to translate ideas into visually appealing designs.Excellent communication and presentation skills.Ability to work collaboratively in a fast-paced, deadline-driven environment."
Operations Strategy Manager for Marketing Agency (US Based/Remote),Full time,Paired,,"Bachelor's degree in Business, Marketing, Operations Management, or a related field.Minimum 5 years of experience in operations management, preferably within the marketing or advertising industry.Demonstrated success in developing and implementing operational strategies to drive efficiency and productivity.Strong analytical and problem-solving skills.Excellent leadership and team management abilities.Exceptional communication and interpersonal skills.Proven ability to work independently and remotely."
Remote Graphic Designer (Specialist in Logo & Branding),Full time,Snaphunt,,"Can actively communicate with customers in written English in real-time.Have graphic design experience.Have a friendly, positive, and great team player attitude!Possess strong attention to detail.Can demonstrate proficiency in Adobe Photoshop, Illustrator, and InDesign.Have experience creating presentations in PowerPoint, and Google Slides.Have experience utilizing Canva.Enjoy looking up and learning new things quickly.Have an eye for accuracy, detail, and quality control.Have excellent communication and client handling skills (Customer Support experience is a plus!).Advanced knowledge in Adobe CC programs requiredFriendly and positive attitudeGreat team player attitudeExperience handling customersOwn reliable computer that meets these RequirementsInternet connection above 20 Mbps
The Employer
Our client is a global creative services company providing thousands of businesses with unlimited, high-quality design and illustration work at a flat rate. Founded in Scottsdale, Arizona, they were created to deliver reliable, affordable, and scalable creative content to any business."
Crypto Social Media Manager (Indonesia-Remote),Full time,Token Metrics,,Not Found
"UX Researcher (Remote, Flexi Schedule)",Full time,Company Confidential,,Not Found
"B2B Sales Manager Indonesia and Vietnam Job - iGaming - Remote, Asia",Full time,"B2B Sales Manager Indonesia and Vietnam Job - iGaming - Remote, Asia",,Not Found
Senior Graphic Designer for DTC Company (US Based/Remote),Full time,Paired,,"Ability to think creatively and come up with original ideas.
Minimum of 5 years of experience in a design role.Proven experience in packaging design, website design, and digital marketing materials.Strong portfolio showcasing a variety of design projects.Proficiency in design software such as Adobe Creative Suite (Photoshop, Illustrator, InDesign).Excellent visual design skills and a keen eye for detail.Strong communication and collaboration skills.Experience working with e-commerce brands is a plus."
Crypto Chief of Staff (Indonesia-Remote),Full time,Token Metrics,,Not Found
Graphic Designer for Tax Company (US Based/Remote) - Project Based,Full time,Paired,,"Ability to think creatively and come up with original ideas.
Minimum of 5 years of experience in a design role.Strong portfolio showcasing a variety of design projects.Proficiency in design software such as Adobe Creative Suite (Photoshop, Illustrator, InDesign).Excellent visual design skills and a keen eye for detail.Strong communication and collaboration skills."
Partnership Manager for Financial YouTuber (US-based/Remote),Full time,Paired,,"Quality of Outreach Communication: Exceptional written and verbal communication skills, with keen attention to detail and the ability to engage diverse audiences.Relationship Building: Strong interpersonal skills, customer service orientation, and proactive networking ability.Adaptability and Problem-Solving: Flexible and resourceful, with strong analytical skills to tackle complex challenges and develop effective solutions.Skill Enhancement: Commitment to continuous learning and professional development, with the ability to train and mentor team members.Initiative and Innovation: Proactive and innovative mindset, capable of managing projects and driving improvements in processes and outcomes."
Data Scientist – Remote,Full time,Company Confidential,,Not Found
Performance Engineer – Remote,Full time,Company Confidential,,"Bachelor’s degree in Computer Science, Engineering, or related field. Master’s degree preferred.Proven experience as a Performance Engineer or similar role, with a strong background in software development and performance testing.Proficiency in performance testing tools such as JMeter, LoadRunner, or Gatling.Experience with monitoring and profiling tools such as New Relic, AppDynamics, or Dynatrace.Solid understanding of software architecture, networking, and database systems.Strong analytical and problem-solving skills with the ability to troubleshoot complex performance issues.Familiarity with scripting and programming languages such as Python, Java, or JavaScript.Excellent communication and collaboration skills, with the ability to work effectively in a team environment.Knowledge of agile development methodologies and continuous integration/continuous deployment (CI/CD) practices.Kindly send us the five letter results. (e.g. ENTJ-T) to[email protected]together with links to your resume and sample works. Subject: Position you are applying for (e.g Backend Engineer)"
Senior Graphic Designer for a DTC Beauty & Skincare Company (US Based/Remote),Full time,Paired,,Not Found
Senior Relationship Manager (Remote),Full time,Snaphunt,,"This FULL-TIME ROLE will only suit someone who also meets the following requirements:
If you believe you are a great fit for the role and meet ALL requirements above, we are looking forward to hearing from you!
The Employer
Our client is a national digital health company with almost 20 years in the industry, comprising 5 divisions including the National Dental Network, Health Fund Partnerships, Projects & Investments plus more recently, Retail Dental Cover and Corporate Dental Cover."
Head of Crypto Investment Research (Indonesia-Remote),Full time,Tokenmetrics,,Not Found
Crypto Data Scientist / Machine Learning Engineer (Indonesia-Remote),Full time,Tokenmetrics,,Not Found
"Performance Engineer (Fully remote, Flexible Schedule)",Full time,Company Confidential,,Not Found
"Performance Optimization Engineer (Fully remote, Flexible Schedule)",Full time,Company Confidential,,Not Found
Senior Backend Developer - Node (100% Remote Indonesia Jakarta),Full time,Tether Operations Limited,,Not Found
UX Researcher – Remote,Full time,Company Confidential,,"Bachelor's or Master's degree in Human-Computer Interaction, Psychology, Sociology, Information Science, or a related field.Proven experience conducting UX research in a professional setting, preferably within a technology or digital product environment.Strong understanding of qualitative and quantitative research methods, including usability testing, interviews, surveys, and data analysis.Proficiency with research tools and software such as user testing platforms, survey tools, and analytics tools.Excellent analytical and problem-solving skills, with the ability to interpret complex data and distill actionable insights.Effective communication skills, with the ability to present research findings and recommendations to diverse audiences.Collaborative mindset and ability to work effectively in a cross-functional team environment.Passion for user-centered design and a commitment to advocating for the needs of our users."
Crypto UI/UX Engineer (Jakarta-Remote),"Full time, Contract/Temp",Token Metrics,,Not Found
Senior Backend Developer - Node (100% Remote Indonesia Surabaya),Full time,Tether Operations Limited,,Not Found
Senior Backend Developer - Node (100% Remote Indonesia Bandung),Full time,Tether Operations Limited,,Not Found
Customer Support (Mekari Talenta),Contract/Temp,PT Mid Solusi Nusantara (MEKARI),,"1 year of related working experience as a Payroll / Compensation Benefit. Fresh graduates from Accounting / Mathematics are also welcome.Good payroll knowledge is a must.People-oriented, proactive, and communicative.Good analytical, logical, and problem-solving skills.Good personality and emphatic.
Required Skills
Persuasion and NegotiationChat SupportCustomer ServiceTypingCommunication SkillsTaxationWilling to independently learn online and offlineFast adaptation"
Customer Support - Yogyakarta Placement,Full time,PT Mid Solusi Nusantara (MEKARI),,Not Found
3D Product/Industrial Designer for Furniture & Storage Products (US/Remote),Full time,Paired,,"Proven experience in 3D product or industrial design, with a strong portfolio demonstrating successful product design projects, particularly in the realm of wooden products, furniture, ornaments, and organizers.Extensive knowledge of manufacturing processes, materials, and production techniques, with a keen eye for balancing design aesthetics with cost-effective manufacturing considerations.Proficiency in 3D modeling software (e.g., Solidworks, Rhino, Autodesk Fusion 360) and rendering tools to create high-quality visualizations and technical drawings.Strong problem-solving skills and the ability to work collaboratively with cross-functional teams to overcome design and production challenges.Excellent communication and presentation skills to effectively convey design concepts and rationale to stakeholders.A passion for innovation and a commitment to creating products that not only meet but exceed customer expectations."
Software Engineer (Mekari Qontak),Full time,PT Mid Solusi Nusantara (MEKARI),,"Good knowledge of Ruby. Experience with Ruby frameworks (e.g. Rails, Sinatra) is a plus.Understand basic Javascript. Experience with Javascript frameworks (e.g. VueJs, ReactJs) is a plus.Familiarity with relational databases concepts (SQL syntax, indexing, structures, and query optimization).Understand programming practices such as separation of concerns, unit testing, and writing self-documenting code.Familiarity with version control systems such as Git or Mercury.Have some experience in deploying an app to the production environment
Soft Skill Requirements:
Integrity and humility is a mustPassionate about problem-solving and software engineeringPossess excellent teamwork skillGood communication skills with technical and non-technical team membersLove to learn new things and share them with others"
Account Manager (Financial Service),Full time,PT Mid Solusi Nusantara (MEKARI),,"Business/Management background with experience in start-up environments is preferableExperience in client-facing rolesPrior 2-3 years experience selling or marketing is a plus but is not requiredExcellent written and verbal communication skills. Fluent in English is a plusComfortable and confident speaking to mid-level and senior executivesStrong organizational skills and interpersonal communication skillsAnalytical, detail-oriented, and results-focused Scrappy and competitiveProficient with corporate productivity and web presentation toolsHave a positive, can-do attitude, extraordinary hustle, disdain for failure, and hunger/appreciation for the feedbackHuge plus: experience selling to HR Manager, CEO, Accountant or Finance Manager Comfortable working in a small, distributed team"
"Product Manager, FI",Full time,Setara Networks,,Not Found
Business Development (Mekari Jurnal),Full time,PT Mid Solusi Nusantara (MEKARI),,"Accounting/Management Background Preferable.Excellent written and verbal communication skills.Comfortable and confident speaking to mid-level and senior executives.Strong organizational skills and  interpersonal communication skills.Analytical, detail-oriented, and results-focused Scrappy and competitive!.Desire to drive results and improve every single day.Prior experience selling or marketing is a plus but is not required.We’re seeking an exceptional individual to help drive the growth of our sales efforts in the rapidly changing local delivery industry.If Possible Have 1-2 years of experience cold calling and selling SaaS or IT products (SMEs / SMBs), Fresh Graduate is also welcomed.If the possible track record of over-achieving quota.Proficient with corporate productivity and web presentation tools.Have a positive, can-do attitude, extraordinary hustle, disdain for failure, and hunger/appreciation for the feedback.Have deep self-motivation and the ability to self-manage.Huge plus: experience selling to HR Manager, CEO, Accountant or Finance Manager Comfortable working in a small, distributed team."
Partner Product Specialist,Full time,PT Mid Solusi Nusantara (MEKARI),,"Having an agile understanding of SaaS IndustryHas prior knowledge of ERP system/Omnichannel-CRM/Accounting (depends on product applied for)Has excellent oral and written communication skillsHas the ability to build relationships & collaborate with othersAble to learn fast and is eager to learnProficiency in processing data using MS Office (MS Excel and MS PowerPoint, in particular)"
Activation Specialist (Mekari Qontak) - Yogyakarta Placement,Full time,PT Mid Solusi Nusantara (MEKARI),,"Candidate must possess at least a Bachelor's Degree, preferably in Information TechnologyAt least 1 year(s) of working experience in a SaaS companyFluent in verbal and written EnglishFamiliar with CRM toolsProficient with corporate productivity and web presentation tools (Microsoft & Gsuite)Good analytical and problem-solving skillsComfortable with numbers and meeting clientsFast learner and independentHaving good interpersonal and teamwork skill"
Legal Associate,Full time,PT Mid Solusi Nusantara (MEKARI),,"Bachelor’s degree in Law from a reputable university.Having at least 1-year experience, preferably from a technology company or a law firm.Experience in drafting a business contract and contract negotiation.Excellent teamwork.Excellent communication in written and oral to liaise with business stakeholders. Able to communicate in English (written and oral) would be an advantage.Excellent analytical skills.Able to juggle multiple assignments simultaneously.Experience in advising non-legal persons on legal risks.Experience operating in ambiguous circumstances.Able to be proactive and take initiative."
Activation Specialist (Mekari Talenta) - Yogyakarta Placement,Full time,PT Mid Solusi Nusantara (MEKARI),,"Candidate must possess at least a Bachelor's Degree Information Technology, Accounting, Human Resource Management or equivalentAt least 1 year(s) of working experience handling Payroll or having experience in HRIS companyRequired skill(s): Knowledgeable of Payroll software, TAX, BPJS, Overtime, and the other Payroll component are related is added valueGood analysisComfortable with numbers and meeting clientsFast learner and independentHaving good interpersonal and teamwork skillAble to work under pressure"
Engineering Manager (Mekari Klikpajak),Full time,PT Mid Solusi Nusantara (MEKARI),,"3+ years experience as a full-time professional managerExperience with Go, Ruby or PHP, plus experience in Kubernetes or other container orchestration systemsExperience building out and maintaining large distributed systemsStrong written and verbal communication skillsPassionate about fostering good engineering practices and processes"
Certification Specialist Lead (Mekari University),Full time,PT Mid Solusi Nusantara (MEKARI),,"Minimum 2 years of related working experience in Accounting, Tax, HR, Learning & Development, or any related field.Candidates must possess at least a Bachelor's Degree in Accounting or equivalent.Required skills: Accounting and Taxation.Having a passion and experience in teaching/training is a must.Excellent written and verbal communication skills.Strong analytical and problem-solving skills.Good interpersonal and teamwork skills.Fast learner and independent.Able to work under pressure in a fast-paced environment.Proficient with corporate productivity and web presentation tools (Microsoft & G Suite).Proficient in Bahasa Indonesia and English."
