Job Title,Job Category,Company Name,Salary,Requirements
"Frontend Engineer, Digital Venture - Fully REMOTE",Contract/Temp,CP AXTRA PUBLIC COMPANY LIMITED,,"You are experienced in building modern JavaScript-based applications in React NativeYou have demonstrable experience with HTML, CSS/LESS/SCSS/etc., JavaScript, ES6+ and responsive designExperience with nest.js, GraphQL and AWSYou have exposure to mobile development with native or web-to-native tooling and frameworksYou understand distributed architecture and usage of RESTful APIs and how to use them in practiceYou are able to write effective unit, integration, and end-user automation tests"
"Full-stack Engineer, Digital Venture - Fully REMOTE",Contract/Temp,CP AXTRA PUBLIC COMPANY LIMITED,,"You are experienced and highly performance in at least one backend and frontend framework, e.g., SpringBoot, node.js (or related frameworks e.g. hapi.js, express.js, metor.js), nest.js, ReactJS, ReactNativeYou have experience in writing unit and acceptance tests, air programming, continuous integration, test-driven development, and incremental designYou have experience with code refactoring, design patters, design-driven development, continuous deployment, and highly scalable applicationsYou demonstrate experience in distributed and modular architectures e.g. microservices-basedYou are excellent understanding of latest development technologiesYou have high energy, strive towards cross-functional development in agile methodologies, inspire teammates to reach their maximum potential, embrace a culture of trust and complete transparency, promotes free thought, brave, rebellious, and willing to challenge status quo"
"Backend Engineer, Digital Venture - Fully REMOTE",Contract/Temp,CP AXTRA PUBLIC COMPANY LIMITED,,"You have experience as a backend engineer in common languages and frameworks, e.g., Node Js, ExpressJS, NestJS or any other JS frameworkYou have experience in AWSYou have experience in GraphQLYou have deep knowledge of object-oriented programing and engineering principles such as SOLIDYou have significant experience writing and utilizing autonomous services-oriented restful API services and performance tuning largescale appsYou have experience with database systems, with knowledge of SQL and NoSQL stores, e.g., MySQL, MongoDB, Redis, PostgresYou are able to write effective unit, integration, and API tests. It is a plus if you experience integrating with JavaScript frameworks, such as React"
DevOps Engineer - Fully REMOTE,Contract/Temp,CP AXTRA PUBLIC COMPANY LIMITED,,"Excellent scripting skills (e.g. Python, Bash, Perl)Experienced with building and maintaining large scale, cloud-based container-based platforms (in IaaS and PaaS)Working knowledge of deployment automation solutions (i.e. Terraform, Puppet, Chef, Ansible)Experienced AWS platform (certification is a plus)Experienced with containers and KubernetesExperienced with continuous integration and related tools such as GitlabCI, Jenkins, Hudson, Maven, Ant, Git, Sonar, etc.Familiar with security automation tools such as static application security testing etcStrong understanding of Agile methodologiesExperience as a DevOps or SRE Engineer on a cross-functional agile team preferred"
HSE and Compliance Manager (Toy/Garment/Footwear - Remote),Full time,METASOURCE COMPANY LIMITED,"$1,700 – $2,500 per month (USD)",Not Found
Inside Sales Representative - Remote (U.S Time),Contract/Temp,PT. PERSOLKELLY Recruitment Indonesia,Rp 8.000.000 – Rp 12.000.000 per month,Not Found
Executive Assistant to CEO (Remote),Full time,PT Sayap Garuda Indah,Rp 8.349.000 – Rp 12.500.000 per month,"Education: Bachelor’s degree in Business Administration or a related field.Age: 28-40 years.Experience: At least 7 years in executive support, preferably in a remote setting.Skills: Exceptional written and spoken English, strong IT skills (Microsoft Office, communication tools), outstanding time management, and multitasking abilities.Qualities: Proactive, organized, and highly reliable in managing diverse responsibilities."
Senior .NET Developer (Full Remote),Full time,DevStack,Rp 14.000.000 – Rp 21.000.000 per month,Not Found
Site Development Supervisor (Remote),Full time,PT MGI GAYA HIDUP MANAJEMEN,Rp 16.000.000 – Rp 20.000.000 per month,Not Found
IT Support,Full time,PT Kredit Biro Indonesia Jaya (Credit Bureau Indonesia),Rp 7.000.000 – Rp 10.000.000 per month,Not Found
Executive Assistant (Full Remote),Full time,DevStack,Rp 6.000.000 – Rp 7.500.000 per month,Not Found
Odoo Developer cum IT Support,Full time,THE MUSIC WORKS PTE. LTD.,"Rp 8,500,000 – Rp 10,000,000 per month","Strong analytical and problem-solving abilities.Effective communication and collaboration skills to work with non-technical teams.High attention to detail and commitment to delivering quality results.Self-motivated and able to work independently while aligning with team goals.
Preferred Skills:"
AI Trainer - Language Specialist (Indonesian/English),Part time,"Ebit Co., Ltd",$5 per hour (USD),"Any writing experience; Enrollment or completion of an undergraduate program in a humanities field or field related to writing
Experience in translating between English and Indonesian
Experience in writing professionally (copywriter, journalist, technical writer, editor, etc.)"
Business Development Manager,Full time,THE MUSIC WORKS PTE. LTD.,"Rp 9,000,000 – Rp 12,000,000 per month",Not Found
Sales Executive  (Remote Work Opportunity),Full time,PT JAC Consulting Indonesia,Rp 20.000.000 – Rp 25.000.000 per month,Not Found
Kerja Remote Freelance WFH Host Live Streaming,Full time,BlueMeteor,Rp 3.500.000 – Rp 5.000.000 per month,"Memiliki Hp Tipe Android
Pendaftaran gratis
kami tidak melihat Ijasah semua bisa,
tanpa pengalaman
yang paling penting percaya diri dan tidak pemalu no drama and open mind please
Terbiasa tampil di depan kamera"
Sales Manager (remotely),Full time,PT. MATCH MAKERS AGENCY,Rp 4.000.000 – Rp 5.500.000 per month,"Proficiency in EnglishMinimum of 2 years of experience in sales, particularly in servicesEnergetic and reliableStrong communication and negotiation skills"
Sales and Service Coordinator (Remote/WFH),Full time,RemoHires,Rp7.000.000 – Rp8.000.000 per month,"Proven experience in telemarketing, customer service, or scheduling roles, with a strong preference for candidates with cold-calling experience.Exceptional communication and interpersonal skills with a customer-centered approach, capable of building positive relationships and managing customer inquiries effectively.High proficiency in both verbal and written English, enabling clear and professional communication with customers and team members.Demonstrated selling skills, especially in conducting cold calls, engaging clients, and guiding them through the sign-up process.Strong data management skills with advanced proficiency in Excel or Google Sheets for accurate record-keeping and organization.Detail-oriented with the ability to manage a high volume of customer information and maintain well-organized, accurate records.Willingness to work overnight hours (9 PM to 5 AM) to effectively support clients in different time zones.Self-motivated and able to work independently in a remote environment, with a proactive approach to problem-solving and task completion.
Device Requirements:
Reliable computer/laptop with updated processor and operating systemStable connection with at least 10 Mbps download speedNoise-canceling headset with microphone"
"Tech Lead, Digital Venture",Contract/Temp,CP AXTRA PUBLIC COMPANY LIMITED,,"Good communicate in English being able to communicate different team and stakeholder within the company.Experience and in-depth knowledge in backend OOP languages preferably Node.js, or open sources technologiesExperience with relational databases query such as SQL, MySQL, PostgreSQLFamiliar with GitOps environment such as ArgoCD, Kubestack , or similarExperience in automation code deployments or tools such as Jenkins, GitLab, or similar.Experience in container technologies such as Docker, Kubernetes or similar.Experience in complex systems, understanding the latest in open API standards and service-oriented architecture"
Recruitment Consultant,Full time,Geekhunter,,Not Found
ERP Consultant (Japanese Speaker) - Jakarta - Remote Work,Contract/Temp,PT. PERSOLKELLY Recruitment Indonesia,Rp 20.000.000 – Rp 30.000.000 per month,"Minimum bachelor’s degree or equivalentAt least 2 years of experience in related fields such as Finance & Accounting, Sales, Procurement, Production, Logistics, or ITProfessional proficiency in Japanese (JLPT N2 or N1 required)Proficient in Microsoft OfficeStrong interpersonal skills and a good team player"
"Coconut Lab Invites Fullstack Developer (Remote, Indonesia)",Full time,Coconut Lab Pte. Ltd.,,"Strong proficiency in React.js and its ecosystemExperience with React Native mobile developmentExpert knowledge in Laravel or Node.js backend developmentExperience with RESTful API design and implementationSolid understanding of database design (MySQL, PostgreSQL)Proficiency in writing unit tests and integration testsVersion control with Git and GitHub workflowStrong command of English for effective communication"
Cloud Engineer (Remote/WFH),Full time,RemoHires,Rp 8.000.000 – Rp 10.000.000 per month,"Bachelor’s degree in Computer Science, Engineering, or related field (or equivalent experience).3+ years in cloud infrastructure, DevOps, or system engineering, with experience advising on cloud strategy.Demonstrated expertise with a major cloud provider (AWS, Azure, or Google Cloud).Proficiency in cloud platforms, infrastructure as code (Terraform, CloudFormation), and containerization tools (Docker, Kubernetes).Strong scripting skills (e.g., Python, Bash, PowerShell) for automation.Solid understanding of networking (DNS, VPN, VPC, load balancing) and cloud security best practices.AWS Certified Solutions Architect, Microsoft Certified: Azure Solutions Architect, or similar.
Requirements:
Analytical skills and strategic thinking to assess and recommend cloud solutions.Strong communication skills for explaining complex technical concepts to clients and collaborating across teams.Self-motivated, able to work effectively in a remote environment."
Sales Marketing,Full time,PT. Osell Selection Indonesia,Rp 4.700.000 – Rp 5.000.000 per month,"Age: 20 - 33 years oldActive English is preferredMinimum High School GraduateHave experience of at least 1 year in the sales and marketing fieldGood communication and negotiation skillsHonest and Good working attitudeExperience in e-commerce, internet, or trade industry is preferredHaving channel / database of household appliance stores / beauty stores / glassware stores / electronics stores in SurabayaHaving own vehicles and SIM C (Required for remote working system)Willing to join immediately"
Sound Designer (Remote),Contract/Temp,PT Sepuluh Sebelas Agensi,,Not Found
Programmer (.NET)  Software Developer (Full Remote),Contract/Temp,PT Profescipta Wahanatehnik,"IDR 6,000,000 - 7,000,000","Minimum 2 year experience in software development process. Freshgraduate are welcome to apply.Candidate must possess at least an Associate Degree from information system or related fields,Familiarity on SDLC process and agile tools,Proficiency in .NET framework and C#,Possesses strong logic and algorithm design,Strong teamwork attitude, independent, and familiar with agile environment."
Front End Developer - Experienced,Full time,PT Gajah Agung Mandiri,Rp 9.000.000 – Rp 13.500.000 per month,"Candidate must possess at least Bachelor's Degree in Engineering (Computer/Telecommunication) or equivalent.Required language(s): EnglishAt least 5 Year(s) of working experience in the related field is required for this position.Required Skill(s): HTML, CSS, Bootstrap,Java Script, React JS, React - Next Js , Mobile Native & Web3 Js (optional )React Native / Android or IOS knowledge ( Kotlin/Swift)  is an advantage.All Frontend Integrations to back end.REST API/GRAPH QL.
Web 3 Integrations knowledge is also an advantage."
Junior Accountant - Manufacturing Industry - Remote Work,Contract/Temp,PT. PERSOLKELLY Recruitment Indonesia,Rp 6.000.000 – Rp 8.500.000 per month,"Bachelor's degree, preferably in Accounting, Business Administration, or related fields.1 year of proven working experience in Accounting.Fresh Graduates with strong academic achievement are also welcome to apply.Proficiency with Microsoft Office products (Word, Outlook, Excel).  Previous experience in Netsuite is preferredAbility to communicate clearly with excellent verbal, written, and listening skillsAbility to work as an individual contributor and as a valued participant in a team-based environmentA high degree of accuracy and attention to detailHigh Integrity, Proactive, and Willingness to learn is a MUST"
Personal Assistant,Full time,Production House,Rp 20.000.000 – Rp 25.000.000 per month,Not Found
QA Auditor,Full time,PT Sriboga Marugame Indonesia,,"Having experience as Quality Assurance in Restaurant/Hospitality/Retail business minimum 2 year.Minimum Bachelor’s degree preferably in Food Technology, Biotechnology or similar.Fluent in Sistem Jaminan Halal, Audit Food Safety, HACCP/GMP/ISO22000.Good Communication in English both oral and written."
Head District Plantation,Full time,ASIA PULP AND PAPER,,Not Found
Senior Accountant for Overseas Project (English Speaker),Contract/Temp,PT Sinyu Investasi Grup,,Not Found
Software Engineer (Remote position available),Full time,PT Fajar Mulia Transindo,Rp 6.000.000 – Rp 8.000.000 per month,"Proficiency in Laravel, React JS, MySQL, and Git.Knowledge of webserver (Apache & Nginx) and UNIX operating systemMinimum of 2 years of relevant software development experience.Strong analytical skills, with the ability to swiftly grasp coding structures.Familiarity with processes such as code review, unit testing, and branch merging."
Java Developer,Full time,PT Bursa Komoditi Dan Derivatif Indonesia,,"Experience as Java Developer with over 3 years of experience in the Financial services industry.Bachelor Degree in Computer Science or equivalentExpertise in Microservices Architecture, high-frequency messaging systems, and API/WebSocket development. Demonstrated ability to design and implement robust, scalable solutions using Java and Kotlin, with a deep understanding of Computer Science fundamentals. Strong advocate for Test-Driven Development (TDD) and Agile methodologies.Proficient in Java Ecosystem: SE/ EE, KotlinSolid experience with Java using Maven, Spring Boot, Hibernate, JPAExtensive experience in designing and developing Microservices-based architecturesKnowledge of Kafka, RabbitMQ for high-throughput messaging and event-driven systemsExpertise in RESTful APIs, WebSocket, Web APIs for real-time data communicationStrong experience with SQL, MySQL, PostgreSQL, database schema design, and optimizationTest-Driven Development (TDD) with JUnit, Mockito, experience with CI/CD pipelines (Jenkins, GitLab CI)Proficient in Git, GitHub, GitLab for source code managementHands-on experience with Agile/Scrum processes, using tools like Jira for project management and issue trackingAny industry certifications will be an added advantage."
Principal Engineer,Full time,"UpperGround by Hudson - Technology, Projects & Transformation",Attactive salary package and bonus scheme (AUD),"Degree in computer science, software engineering, machine learning, mathematics, or a related discipline.10+ years of relevant programming experience with a proven track record in software development.Proficiency in Java, Spring Boot, and microservices architecture.Experience in relational database design and management, and databases like MongoDB or DynamoDB for flexible data storage.Skilled at accurately estimating development and testing efforts.Familiar with the latest industry trends and development methodologies.Ability to influence and execute across teams.Strong mentoring skills.Capability to translate strategy into execution.
Your Personal Qualities:
Strong decision-making skills.Collaborative and cooperative.Excellent at building rapport and achieving consensus across teams.Proficient in navigating ambiguity and bridging gaps in understanding.
Are you a skilled Principal Engineer ready to lead and innovate? Join Nuix, where diversity and inclusion are at the heart of their culture. Apply now to drive impactful projects in a supportive environment that values your expertise and fosters your professional growth. Seize this opportunity to move to Australia-apply today and be a part of Nuix's success story!"
IT Technology Analyst (Contract Position),Contract/Temp,PT Bredero Shaw Indonesia,,"The candidate must possess at least Bachelor Degree in Information Technology.At least 5 Year(s) of working experience in the similar role.Experience in a customer facing IT or engineering related companyFamiliarity and prior usage of windows operating systems, MS Office365, One Drive, Networking and Basic Wiring, PC and Laptop Hardware, Wireless and Access Point Technology, Basic Active Directory, Helpdesk Management System, Video Conferencing, Desktop Imaging, Remote Support, VoIP Phone System, MS Teams, Desktop Firewalls.Excellent communications skills; Good English language both oral & written; Team & Independent worker; Attention to details; Time Management; Ability to work with minimum supervision."
SALES ENGINEER for HV/EHV Product,Full time,PT. TRI MITRA ELEKTRIK,,"S1 in Electrical/Electronic/MechanicalGood communication, presentation and fluent in English.Excellent in MS Office particularly Microsoft Excel.Minimum 5 years experience in selling HV/EHV Transmission & Substation products to PLN UIP/UIT and Power Generation/IPPAge between 30 – 45 years (retiree also welcome)Customer focus and willing to travel within Indonesia/overseas.Dynamic and hard worker.Have own vehicle."
Full Stack Developer (Remote),Contract/Temp,Elisys Sistem Integrasi,Rp 5.000.000 – Rp 7.000.000 per month,Not Found
3D Architecture Visual Renderer/Artist,Full time,PT INTER TEKNO GRADIAN,Rp6.000.000 – Rp9.000.000 per month,Not Found
Marine Engineering Manager,Contract/Temp,PT. Egenkit Teknik Solusi,Rp 10.000.000 – Rp 15.000.000 per month,Not Found
Brand Manager (Skincare),Full time,PT.MYVENUS NETWORK INDONESIA,Rp 10.000.000 – Rp 15.000.000 per month,Not Found
Customer Success Specialist - Sport Tech Startup,Full time,PT Ayo Indonesia Maju (ayo.co.id),Rp 5.000.000 – Rp 7.000.000 per month,"Minimum 1 year of experience in customer service or a similar role.Proven ability to build strong relationships and provide exceptional customer support.Excellent communication and interpersonal skills, both written and verbal.Outgoing and friendly personality.Strong analytical and problem-solving skills.Proficient in using computers and comfortable learning new software tools.Passionate about sports and a strong understanding of the Indonesian sports landscape (a plus).Ability to work independently and manage multiple tasks simultaneously."
Internal Audit Manager,Full time,CINEPOLIS INDONESIA,,"Bachelor's degree in Accounting, Finance, Business Administration, Master Degree will be Advantage.Professional certification such as COSO, ISO, CPA, CIA, or CISA will be an advantage.3 years experience implementing processes and conducting audits in international companies, 2 years in a Big 4 firm preferred.Strong understanding of auditing standards, risk management, financial reporting, and corporate governance.Familiarity with Indonesian laws and regulations concerning internal controls, financial audits, and compliance.Ability to analyze complex data, identify discrepancies, and recommend solutions for improving processes and risk management.Willing to travel across Indonesia with high frequency.Excellent communication skills to present findings and recommendations to senior management.Excellent technical skill in Microsoft Excel for data analytics.Excellent communication and presentation skills in English."
Mandarin Speaker in Education Field (Multiple Roles - Full Time),Full time,Elite Asia,Rp 5.000.000 – Rp 7.000.000 per month,"1. Experience in Applying to Chinese Universities with Scholarships: Prior experience successfully applying to Chinese universities with scholarships is highly preferred. Familiarity with the application process and scholarship opportunities is a significant advantage.
2. Fast Learner: The candidate should be a quick learner who can understand a large amount of dynamic information in a short period of time, digest them and explain them to the customers.
3. Responsiveness: Timely and effective communication is crucial. The candidate should be responsive to inquiries and able to provide prompt assistance to students and parents.
4. Resourcefulness: The ability to find solutions and workarounds to potential challenges or obstacles in the application process is essential. Resourcefulness in helping students secure scholarships and navigate complex procedures is a valuable skill.
5. Responsibility: Demonstrated responsibility in handling confidential student information, managing financial transactions, and ensuring all tasks are completed accurately and on time is required.
6. Mandarin Proficiency (HSK 4-6): Proficiency in Mandarin, typically at HSK 4 to 6, is essential, enabling effective communication with Chinese universities. Mandarin is also the working language in IndoPanda.
Remuneration: Basic Salary + Commission"
DEPUTY PROJECT MANAGER,Full time,PT Indocater,"Rp 30,000,000 – Rp 35,000,000 per month",Not Found
Field Sales Trainer - Across Indonesia Homebased,Full time,SKINTIFIC,,Not Found
Real Estate Marketing (Placement in Bali),Part time,Toucan Bali Property,Rp 3.000.000 – Rp 3.500.000 per month,"Real estate marketing experience Strong communicationInterpersonal skills Proficiency in digital marketing toolsTechniques Knowledge of the real estate market trendsCustomer behavior Independent work ability Attention to detail and strong organizational skills Flexibility and adaptabilityMinimum 1 year of experience in Real StatePlacement in Kuta, Bali"
Personal Assistant,Full time,PT Sie Chantik SLR Indonesia,Rp 5.500.000 – Rp 7.500.000 per month,Not Found
HR Operations,Contract/Temp,PT. AETHER DIGITAL INDONESIA,,"Strong oral, written, visual communications skillsAttention to detailsProfessional & Proactive work ethic"
"SENIOR SALES ENGINEER for SCADA (RTU), EFI and RELAY PROTECTION",Full time,PT. TRI MITRA ELEKTRIK,,Not Found
Offline Marketing (Public Relations) Manager,Full time,PT Inspirasi Edukasi Indonesia,Rp 6.000.000 – Rp 9.000.000 per month,Experience in offline marketing.Deep understanding of the Indonesian market and its specifics.Creativity and ability to develop unique marketing strategies.Excellent communication skills and the ability to work in a team.Ability to analyze campaign results and make necessary adjustments.
Graphic & Social Media Designer,Full time,PT NITIFESE GLOBAL HORIZON,"Rp 3,500,000 – Rp 4,000,000 per month","- Pendidikan terakhir minimal SMA/SMK
- Dapat bekerja di bawah tekanan
- Dapat bekerja secara independent maupun dengan tim
- Berkarakter baik, jujur, bertanggung jawab, serta rajin
Apabila anda memiliki minat dan ketertarikan dalam bidang properti, kami mengundang anda untuk melamar pada posisi ini dan bergabung dalam tim kami di Polar Brand."
Customer Support and Sales Specialist,Full time,Private Advertiser,Rp 5.000.000 – Rp 6.500.000 per month,"2-3 years of experience in account management, customer service, or sales.Bachelor’s degree in Business, Marketing, or a related field.Fluent in English and Bahasa, with excellent communication skills (written and verbal).Proficiency with WhatsApp, email, and other communication tools.Independent, detail-oriented, and highly organized.Customer-first mindset with a proactive, solution-driven approach.Ability to work remotely."
Salesforce Marketing Cloud/Pardot Expert,Full time,PT Datamine Software Indonesia,,"3+ years of experience working with Salesforce Marketing Cloud/Pardot.Strong understanding of email marketing, automation, and customer segmentationExperience in building and optimizing customer journeys in Salesforce Marketing CloudProficiency in data analysis with a focus on driving insights and campaign performance improvementsFamiliarity with Salesforce CRM and experience with lead management.Excellent organizational and project management skills.Experience with Microsoft Power BIHTML coding experience preferredSalesforce certifications (e.g., Marketing Cloud Email Specialist, Pardot Specialist) are a plus.Fluent in English & Bahasa"
Meeting Setter (Sales Team),Full time,Kreloses Teknologi,Rp 5.000.000 – Rp 7.500.000 per month,Not Found
Android Developer,Full time,PT Lifty Media Indonesia,Rp 10.000.000 – Rp 15.000.000 per month,"● Minimum 1 years of experience in Android development.
● Strong proficiency in Kotlin (minimum 2 years).
● Proven ability to write clean, efficient, and maintainable code.
● Experience with version control systems
● Strong problem-solving and debugging skills.
● Excellent communication and collaboration abilities.
● A passion for creating exceptional user experiences."
Graphic Designer (Offshore),Contract/Temp,PropNex Realty Pte Ltd,"$800 – $1,200 per month (SGD)",Not Found
