Job Title,Job Category,Company Name,Salary,Requirements,Level of Education
SAP Logistics Consultant,Freelance,Fluit Pte Ltd,Rp 12.000.000 – 15.000.000 per month,"Skills: • Proficiency in frontend (SAPUI5) and backend (ABAP/OO) programming languages for developing custom SAP solutions. • Extensive knowledge and practical experience with Enhancement Spots for customizing SAP standard functionalities. • Strong understanding and utilization of Business Add-Ins (BAdIs) for implementing custom enhancements in SAP applications. • Hands-on experience with Business Application Programming Interfaces (BAPIs) for integrating external applications with SAP systems. • Proficiency in Application Link Enabling (ALE) and Intermediate Documents (IDocs) for data exchange between different systems. • Knowledge and experience in Business Rule Framework Plus (BRFplus) for defining and executing business rules within SAP systems. • Strong knowledge of SAP SD, MM, LE, LO, PP, PS, PM, QM, CS, GTM, GTS, BRIM, and other major modules. • Experience with project management methodologies such as Agile or Waterfall. • Excellent communication and interpersonal skills. • Ability to work individually and collaborate with a team. • Professional English language skills. Preferred Skills and Qualifications • Interface knowledge with SAP and Non-SAP systems. • Relevant certifications like SAP Certified Process Associate and SAP Certified Development Associate. • Exposure and hands-on in configuration, customizing, and deployment. • Aware of the latest SAP technologies, tools, and best practices. • Professional German language skills. | Qualifications: • Bachelor’s degree in computer science, Information Technology, or a related field. • Minimum 7 years of hands-on techno-functional experience in SAP logistics.","Master / S2, Sarjana / S1"
Business Developement Lead,Kontrak,PT Karya Komunikasi Nusantara,Rp 3.000.000 – 4.000.000 per month,Skills: Excellent communication skills Strong English proficiency (written & verbal) Analytical thinking dan business acumen Self-motivated dan target oriented Kemampuan bekerja mandiri | Qualifications: Pendidikan Min Diploma Pengalaman 1-2 tahun di sales/business development,"Diploma/D1/D2/D3, Master / S2, Sarjana / S1"
Operator Pemasaran,Purna Waktu / Full Time,PT ZAO TEKNO INDONESIA,Rp 4.000.000 – 5.000.000 per month,Skills: Keahlian berkomunikasi dengan semua orang Terbiasa dengan dunia lapangan dan Pemasaran | Qualifications: Memiliki pengalaman yang sama lebih disukai,SMA / SMK / STM
Reporter,Freelance,Banyuwangi viva,Rp 3.000.000 – 4.000.000 per month,Skills: Kemampuan teknik wawancara yang baik. Kemampuan menulis artikel berita dengan gaya jurnalistik. Penguasaan teknik fotografi dan pembuatan video. | Qualifications: Pengalaman minimal 1 tahun di bidang jurnalistik. Pendidikan S1 sederajad,Sarjana / S1
SAP Financials Consultant,Freelance,Fluit Pte Ltd,Rp 12.000.000 – 15.000.000 per month,"Skills: • Proficiency in frontend (SAPUI5) and backend (ABAP/OO) programming languages for developing custom SAP solutions. • Proficiency in Application Link Enabling (ALE) and Intermediate Documents (IDocs) for data exchange between different systems. • Knowledge and experience in Business Rule Framework Plus (BRFplus) for defining and executing business rules within SAP systems. • Strong knowledge of SAP FI, CO, PS, TRM, GTM, GTS, BRIM, and other major modules. • Experience with project management methodologies such as Agile or Waterfall. • Excellent communication and interpersonal skills. • Ability to work individually and collaborate with a team. • Professional English language skills. Preferred Skills and Qualifications • Interface knowledge with SAP and Non-SAP systems. • Relevant certifications like SAP Certified Process Associate and SAP Certified Development Associate. • Exposure and hands-on in configuration, customizing, and deployment. • Aware of the latest SAP technologies, tools, and best practices. | Qualifications: • Bachelor’s degree in computer science, Information Technology, or a related field. • Minimum 7 years of hands-on techno-functional experience in SAP financials.","Master / S2, Sarjana / S1"
Guru Les,Paruh Waktu / Part Time,Nadyagadget,Rp 2.000.000 – 3.000.000 per month,"Skills: Keahlian Mengajar Keahlian dalam Penggunaan Metode Pembelajaran yang Variatif Keahlian Akademik dan Pengetahuan Mata Pelajaran Keahlian Teknologi Pendidikan (mengajar secara online, kemampuan untuk mengoperasikan platform seperti Zoom, Google Classroom, atau aplikasi lainnya penting). | Qualifications: Memiliki pengalaman dibidang terkait lebih disukai freshgraduate dipersilahkan melamar",SMA / SMK / STM
Marketing,Kontrak,Indodharma Corpora,Rp 7.000.000 – 8.000.000 per month,Skills: Kemampuan public speaking yang baik. Kemampuan administrasi yang terorganisir. | Qualifications: Pengalaman minimal 3 tahun di bidang pemasaran atau yang relevan. Pendidikan minimal SMA sederajad,"Diploma/D1/D2/D3, SMA / SMK / STM"
Sales Executive,Kontrak,Goto Financial,Rp 5.000.000 – 6.000.000 per month,"Skills: – Excellent communication and interpersonal skills. – Customer service and relationship management skills. – Ability to work independently and as part of a team. – Knowledge of financial products, preferably digital wallets and payment systems. – Proven track record in sales, preferably in digital payment services/banking industry. | Qualifications: – Min. 1-2 years experience of Direct Sales/Offline Canvassing – Fresh Graduate or Bachelor’s at any field – Experience in fintech or financial services is a plus.","Diploma/D1/D2/D3, Sarjana / S1, SMA / SMK / STM"
Sales Online,Paruh Waktu / Part Time,Vita Cosmology,Rp 2.000.000 – 3.000.000 per month,Skills: Kemampuan penjualan yang mumpuni dan strategi pemasaran yang inovatif. Kemampuan berbicara di depan audiens akan menjadi nilai tambah | Qualifications: 1. Pendidikan minimal SMA/SMK sederajat 2. Wajib mempunyai HP dan jaringan wajib selalu stabil 3. Tidak sedang bekerja di tempat lain 4. Siap ngonten bersama team lainnya (jika diperlukan),SMA / SMK / STM
Content Creator,Paruh Waktu / Part Time,PT Cipta Purwa Mandiri,Rp 2.000.000 – 3.000.000 per month,Skills: Pengalaman minimal 1 tahun untuk bidang yang sama | Qualifications: Minimum SMA dan mampu membuat content creatif,SMA / SMK / STM
Business Manager Assistant,Kontrak,Trust Technology Corporation,Rp 8.000.000 – 9.000.000 per month,"Skills: sales, marketing, business, etc. Language: – ENGLISH, the ability to connect with overseas customers – Chinese, the ability to communicate in Mandarin (Listening/Speaking) | Qualifications: 1. Graduated with subjects in economics, management, finance, and international trade, or other relevant subjects 2. Bachelor’s Degree 3. New graduates are welcome, training is provided, willingness to learn",Sarjana / S1
Sales Area,Purna Waktu / Full Time,LUNA SUMUT,Rp 3.000.000 – 4.000.000 per month,"Skills: – Kemampuan komunikasi yang baik. – Memiliki kemampuan negosiasi yang kuat dan dapat meyakinkan pelanggan potensial. – Memiliki pemahaman yang baik tentang produk dan layanan yang ditawarkan. – Kemampuan untuk bekerja secara mandiri dan juga dalam tim. – Kemampuan untuk bekerja di bawah tekanan dan mencapai target penjualan. | Qualifications: Fresh graduate diperbolehkan untuk melamar. Pengalaman kerja minimal 1 tahun dalam penjualan, preferensi dalam penjualan di bidang aksesories handphone. Mampu mengendarai kendaraan dan memiliki SIM C (Surat Izin Mengemudi Kelas C) yang valid.",SMA / SMK / STM
Sales Promotion Mobile / Canvasser,Freelance,DGW Fertilizer,Rp 2.000.000 – 3.000.000 per month,"Skills: Mampu berkomunikasi dengan baik Negotiation dan Sales skill | Qualifications: •	Minimal pendidikan SMA/SMK/S1 Semua Jurusan •	Siap untuk sistem kerja mobile •	Dapat mengendarai mobil & memiliki SIM A •	Area kerja Jawa Barat / Jawa Tengah / Jawa Timur","Sarjana / S1, SMA / SMK / STM"
Social Media Specialist,Freelance,Klinbersih.com,Rp 1.000.000 – 2.000.000 per month,"Skills: 1) Jago ngedit video pakai InShot atau CapCut 2) Terbiasa ngelola media sosial, terutama Instagram dan Facebook. 3) Bisa bikin desain grafis pakai aplikasi desain dasar seperti Canva. 4) Copywriting yang kreatif dan engaging 5) Update dengan tren di media sosial terbaru dan ngerti algoritma | Qualifications: Minimal 1 tahun pengalaman ngurus media sosial atau content creation","Diploma/D1/D2/D3, Sarjana / S1, SMA / SMK / STM"
Sales Representative,Purna Waktu / Full Time,PT SOLUSI SUMBER SINAR,Rp 3.000.000 – 4.000.000 per month,"Skills: Mampu Mengoperasikan Komputer (Ms Word, Excel, Power Point) Mampu Berkomunikasi Dengan Baik | Qualifications: Minimal lulusan D1. Memiliki kendaraan sendiri. Pernah punya pengalaman sales min 2 thn.","Diploma/D1/D2/D3, Sarjana / S1"
Sales Canvasser,Kontrak,PT. KOTAK HIJAU UTAMA,Rp 5.000.000 – 6.000.000 per month,"Skills: Mampu berkomunikasi dengan baik, siap bekerja target, kemampuan negosiasi | Qualifications: – Pendidikan min. SMK – Pengalaman sebagai Sales Lapangan","Diploma/D1/D2/D3, SMA / SMK / STM"
IT Marketing Consultant,Kontrak,Stralentech IT Solution,Rp 10.000.000 – 12.000.000 per month,"Skills: Mahir dalam melakukan presentasi produk kepada klien dan calon pelanggan. Luwes dalam berkomunikasi, baik dalam bahasa Indonesia maupun bahasa Inggris. Mampu berkomunikasi dengan baik dalam bahasa Inggris (baik lisan maupun tulisan). Kemampuan menggunakan alat analisis data dan pelaporan. | Qualifications: Gelar sarjana dalam bidang pemasaran, bisnis, teknologi informasi, atau bidang terkait. Pengalaman kerja minimal 1 tahun di bidang pemasaran, terutama pemasaran produk IT atau teknologi. Pengalaman dalam mengembangkan dan mengelola kampanye pemasaran digital. Berumur antara 21 hingga maksimal 35 tahun. Domisili Jakarta Timur",Sarjana / S1
Social Media Specialist,Freelance,Ornada,Rp 2.000.000 – 3.000.000 per month,"Skills: Menguasai design graphis Memahami fitur, algoritma, dan praktik terbaik di berbagai platform sosial media | Qualifications: Berpengalaman bekerja di bidang Grafis Bersedia untuk bekerja sebagai freelance","Sarjana / S1, SMA / SMK / STM"
Digital Marketing,Kontrak,PT. Ebi Multisindo Internusa,Rp 5.000.000 – 6.000.000 per month,Skills: 1.Pembuatan Website 2.SEO (Search Engine Optimization) 3.Social Media Marketing 4.Content Marketing 5.Video Marketing 6.Creative Design | Qualifications: 1.WFH (work from home). 2.Menguasai platform sosial media. 3.Ahli di bidang marketing digital. 4.Fasih berbahasa Inggris lisan & tulisan. 5.Memiliki perangkat kerja pribadi.,Diploma/D1/D2/D3
Multimedia Creative Assistant Manager,Paruh Waktu / Part Time,PT. Surya Vita Kencana,Rp 2.000.000 – 3.000.000 per month,Skills: Platform Kerja: -MS. Word -MS. Office -Adobe Photoshop -Adobe Illustrator -Canva -Asana -Time doctor | Qualifications: Minimal pengalaman 2 tahun di bidang yang sama. Pendidikan minima Diploma,"Diploma/D1/D2/D3, Sarjana / S1"
Sales,Purna Waktu / Full Time,PT. GLORY BERKAT UNGGUL,Rp 4.000.000 – 5.000.000 per month,Skills: menguasai skill komunikasi yg baik bisa mengendarai motor | Qualifications: Min. SMA/SMK/Sederajat Pengalaman Min.1 th dibidang yang sama Bisa mengendarai motor dan mempunyai Motor + SIM C Bersedia Keluar Kota,"Diploma/D1/D2/D3, SMA / SMK / STM"
Korean Translator,Purna Waktu / Full Time,nextersystems,Rp 6.000.000 – 7.000.000 per month,"Skills: Mampu berbahasa Korea Paham 3D / Design Grafis – materi lengkap bisa dipelajari setelah bergabung di perusahaan Dapat bekerja Remote , menggunakan Goggle Drive dan Google Chat/Meet | Qualifications: Memiliki PC / Laptop, dengan syarat Hardware / perangkat sbb : CPU 1) Setara i3 Intel Core i3-10100 (Generasi ke-10) Core/Thread: 4 Core / 8 Thread Kecepatan Clock Dasar: 3.6GHz Kecepatan Clock Maksimal: 4.3GHz Proses Pembuatan: 14nm TDP: 65W 2) Setara i5 Intel Core i5-8400 (Generasi ke-8) Core/Thread: 6 Core / 6 Thread Kecepatan Clock Dasar: 2.8GHz Kecepatan Clock Maksimal: 4.0GHz TDP: 65W 3) Seri AMD AMD Ryzen 5 3600 Core/Thread: 6 Core / 12 Thread Kecepatan Clock Dasar: 3.6GHz Kecepatan Clock Maksimal: 4.2GHz Proses Pembuatan: 7nm TDP: 65W RAM minimal 8GB atau lebih Monitor dan Grafis Ukuran 20 inci atau lebih besar Resolusi 1920 x 1080 atau lebih tinggi Bagi pengguna laptop, harus dapat menghubungkan monitor eksternal","Diploma/D1/D2/D3, Sarjana / S1, SMA / SMK / STM"
Sub Project Manager,Kontrak,nextersystems,Rp 6.000.000 – 7.000.000 per month,"Skills: Mampu berbahasa Korea Berpengalaman di pengerjaan 3D Lidar / Line Drawing (LDRDB) Dapat bekerja Remote , menggunakan Goggle Drive dan Google Chat | Qualifications: Memiliki PC / Laptop, dengan syarat Hardware / perangkat sbb :CPU 1) Setara i3 Intel Core i3-10100 (Generasi ke-10) Core/Thread: 4 Core / 8 Thread Kecepatan Clock Dasar: 3.6GHz Kecepatan Clock Maksimal: 4.3GHz Proses Pembuatan: 14nm TDP: 65W		 2) Setara i5 Intel Core i5-8400 (Generasi ke-8) Core/Thread: 6 Core / 6 Thread Kecepatan Clock Dasar: 2.8GHz Kecepatan Clock Maksimal: 4.0GHz TDP: 65W		 3) Seri AMD AMD Ryzen 5 3600 Core/Thread: 6 Core / 12 Thread Kecepatan Clock Dasar: 3.6GHz Kecepatan Clock Maksimal: 4.2GHz Proses Pembuatan: 7nm TDP: 65W		 RAM minimal 8GB atau lebih		 Monitor dan Grafis Ukuran 20 inci atau lebih besar Resolusi 1920 x 1080 atau lebih tinggi		 Bagi pengguna laptop, harus dapat menghubungkan monitor eksternal","Diploma/D1/D2/D3, Sarjana / S1, SMA / SMK / STM"
Manager Accounting Pajak,Purna Waktu / Full Time,PT Interkoneksi Indo Teknologi,Rp 12.000.000 – 15.000.000 per month,"Skills: Menguasai sistem ERP, Microsoft Office, familiar dengan DJP Mengerti serta memahami standar accounting, sistem serta regulasi perpajakan, Fasih berbahasa Indonesia dan Inggris (Mandarin lebih baik lagi) | Qualifications: Pria / Wanita Berusia 27 – 38 tahun Memiliki min pengalaman 2 – 3 tahun bekerja sesuai bidang (accounting dan perpajakan) PendidikanS1 sederajad",Sarjana / S1
Staff Marketing,Kontrak,DS Store,Rp 3.000.000 – 4.000.000 per month,Skills: 1. Memiliki pengetahuan tentang platform dan alat pemasaran afiliasi 2. Keterampilan komunikasi yang baik | Qualifications: 1. Perempuan 2. Usia maksimal 28 tahun 3. Pendidikan minimal S1 semua jurusan 4. Aktif berorganisasi 5. Berpenampilan menarik,Sarjana / S1
Telemarketing,Purna Waktu / Full Time,PT. PARASIDE REALTY INDONESIA,Rp 2.000.000 – 3.000.000 per month,"Skills: 1. Menguasai skill komunikasi dan negosiasi 2. Memahami product knowledge 3. Kemampuan memecahkan masalah 4. Familiar dengan e-commers, internet dan industri digital | Qualifications: 1. Wanita usia 25 – 27 tahun 2. Berpengalaman min 3 tahun dalam bidangnya 3. Mampu bekerjasama dengan tim","Diploma/D1/D2/D3, SMA / SMK / STM"
Tutor Matematika Online,Freelance,Bimbel Xyz,Rp 3.000.000 – 4.000.000 per month,"Skills: Aplikasi Zoom, Gmeet, Microsoft Office Memiliki kemampuan berkomunikasi yang baik, baik secara lisan maupun tulisan. Memiliki kemampuan menjelaskan materi matematika dengan jelas dan mudah dimengerti. | Qualifications: Wanita Lulusan Sarjana Matematika atau jurusan terkait. fresh graduate silahkan melamar Memiliki komitmen untuk bekerja secara profesional dan tepat waktu.",Sarjana / S1
Supervisor Marketing,Purna Waktu / Full Time,PT. PARASIDE REALTY INDONESIA,Rp 3.000.000 – 4.000.000 per month,Skills: 1. Bekomunikasi 2. Pemahaman Produk 3. Leadership | Qualifications: 1. Pria / Wanita mask. 40 tahun 2. Pendidikan min. SMA/ Sederajat 3. Berpengalaman min. 5 tahun atau lebih diutamakan dibidang perumahan komersil 4. Memiliki kendaraan pribadi 5. Bertutur kata baik dan sopan 6. Berpenampilan rapi,"Diploma/D1/D2/D3, Sarjana / S1, SMA / SMK / STM"
Penulis Lepas Bilingual - Pelatih AI,Contract,DataAnnotation,"Rp 49,691,840.00 per Month","Kualifikasi:
- Fasih berbahasa Indonesia dan Inggris (tingkat native atau bilingual)
- Gelar sarjana (sedang dijalani atau sudah selesai)
- Keterampilan menulis dan tata bahasa yang sangat baik
- Keterampilan penelitian dan pengecekan fakta yang kuat untuk memastikan keakuratan dan orisinalitas",
Penerjemah Bilingual - Pelatih AI,Contract,DataAnnotation,"Rp 49,691,840.00 per Month","Kualifikasi:

- Fasih berbahasa Indonesia dan Inggris (tingkat native atau bilingual)
- Gelar sarjana (selesai atau sedang berjalan)
- Keterampilan menulis dan tata bahasa yang sangat baik
- Keterampilan riset dan pengecekan fakta yang kuat untuk memastikan keakuratan dan orisinalitas",
Tutor- AI Trainer,Contract,DataAnnotation,"Rp 50,675,200.00 per Month","Qualifications:

Fluent in Indonesian + English
A bachelor's degree (completed or in progress)
Excellent writing and grammar skills
Strong research and fact-checking skills to ensure accuracy and originality",
Editor Konten Bilingual - Pelatih AI,Contract,DataAnnotation,"Rp 49,691,840.00 per Month","**Kualifikasi:**

- Fasih berbahasa Indonesia dan Inggris (tingkat native atau bilingual).
- Gelar sarjana (sudah lulus atau sedang menempuh pendidikan).
- Keterampilan menulis dan tata bahasa yang sangat baik.
- Keterampilan riset dan pengecekan fakta yang kuat untuk memastikan keakuratan dan orisinalitas.",
Bilingual Freelance Writer - AI Trainer,Contract,DataAnnotation,"Rp 49,691,840.00 per Month","Qualifications:

Fluent in Indonesian + English
A bachelor's degree (completed or in progress)
Excellent writing and grammar skills
Strong research and fact-checking skills to ensure accuracy and originality",
Translator- AI Trainer,Contract,DataAnnotation,"Rp 50,675,200.00 per Month","Qualifications:

Fluent in Indonesian + English
A bachelor's degree (completed or in progress)
Excellent writing and grammar skills
Strong research and fact-checking skills to ensure accuracy and originality",
Localization Specialist- AI Trainer,Contract,DataAnnotation,"Rp 50,675,200.00 per Month","Qualifications:

Fluent in Indonesian + English
A bachelor's degree (completed or in progress)
Excellent writing and grammar skills
Strong research and fact-checking skills to ensure accuracy and originality",
Travel Consultant- AI Trainer,Contract,DataAnnotation,"Rp 50,675,200.00 per Month","Qualifications:

Fluent in Indonesian + English
A bachelor's degree (completed or in progress)
Excellent writing and grammar skills
Strong research and fact-checking skills to ensure accuracy and originality",
Bilingual Community Manager- AI Trainer,Contract,DataAnnotation,"Rp 50,675,200.00 per Month","Qualifications:

Fluent in Indonesian + English
A bachelor's degree (completed or in progress)
Excellent writing and grammar skills
Strong research and fact-checking skills to ensure accuracy and originality",
Bilingual Customer Support Specialist- AI Trainer,Contract,DataAnnotation,"Rp 50,675,200.00 per Month","Qualifications:

Fluent in Indonesian + English
A bachelor's degree (completed or in progress)
Excellent writing and grammar skills
Strong research and fact-checking skills to ensure accuracy and originality",
Interpreter- AI Trainer,Contract,DataAnnotation,"Rp 50,675,200.00 per Month","Qualifications:

Fluent in Indonesian + English
A bachelor's degree (completed or in progress)
Excellent writing and grammar skills
Strong research and fact-checking skills to ensure accuracy and originality",
Bilingual Marketing Specialist- AI Trainer,Contract,DataAnnotation,"Rp 50,675,200.00 per Month","Qualifications:

Fluent in Indonesian + English
A bachelor's degree (completed or in progress)
Excellent writing and grammar skills
Strong research and fact-checking skills to ensure accuracy and originality",
Backend Engineer (3+ Years Experience),Full-time / Contract,Pabbl,"Rp. 10,000,000 - Rp. 17,000,000 a month","Requirements:

3+ years of experience in backend development.
Proficiency in Java and Spring.
Strong experience with MySQL database design and optimization.
Excellent problem-solving skills.
Good communication skills and a team player.
Organized and detail-oriented.
Basic data analysis skills.
Fluent in English.
Based in Indonesia (preferably Bali), but remote work is possible.
Knowledge of ElasticSearch for search solutions (optional).
Familiarity with monitoring tools like Grafana (optional).
Experience with Retool and React Native is a plus (optional).",
Real Estate Acquisitions Analyst (Fully Remote),Full-time,COARE Communities LLC,"""Rp 26,490,655 - Rp 33,113,318 per Month""","Requirements:

A modeling test will be required as part of the interview process
Must be comfortable working 9:00AM - 5:00PM EST (US Time Zone)
1 to 2 years proven work experience as an Analyst, Associate, Accountant or similar role
Prior background in Finance or Accounting required
Must be willing to work and entertain queries outside of regular working hours
Comfortable working in fast-paced environment with multiple competing deadlines
Highly organized with ability to prioritize work independently with minimal oversight
Impeccable attention to detail with a natural strength in mathematic
Highly responsive, able to respond to any inquiries from the acquisition team or 3rd parties within an hour of receipt during business hours",
Customer Service Officer (Remote) (English Speaking),Full-time,The Swim Starter,"Rp. 4,500,000 a month","Job Requirement

Fluent in English
A minimum of 2 years of experience is required (experience in the same industry would be an added advantage).
Able to adapt with fast-paced working environment
Good with numbers, data analysis
Fast learner (able to learn to use in-house system to handle leads)
Ad-hoc ops duties.
Implementing contingency flows in the case of an emergency.
Assist with Bi-annual test operations.
Preparing of Attendance for weekly classes.
Ensure that all tasks and checks assigned to Supervisors are carried out smoothly.",
Paid Internship - Sales Intern (100% Remote),Part-time / Internship,Integris Capital,"Rp. 2,328,847 a month","QUALIFICATIONS:

Currently enrolled in a Bachelor's degree program, preferably in Marketing, Sales, Business Administration, or a related field
Strong written and verbal communication skills in English
Excellent interpersonal skills and ability to work effectively in a distributed team environment
Self-motivated with a strong desire to learn and grow in the sales field, adaptable to different cultural and business contexts
Organized, detail-oriented, and able to manage multiple tasks efficiently in a remote work environment.",
Business Development Representative (Indonesia - Jakarta based) - Remote,Full-time,PeopleScope (Asia),"Rp. 8,500,000 - Rp. 14,000,000 a month","SKILLS/REQUIRMENTS:

· Excellent verbal communication skills with a pleasant and confident telephone voice in speaking with business / technical decision makers

· Exceptional business written communication and grammar is a must

· Proficiency in Microsoft Office Suite, including Word and Outlook, Salesforce and LinkedIn is a plus

· 5+ years working experience (in B2B IT / telecom industry is a plus) with/or 3+ years of telemarketing or telesales experience in up sell or cross selling of solutions related to data center, collocation, network, managed services or private / public cloud.

· Business-level fluency in other languages is a plus (Bahasa Indonesia, English)

· Bachelor’s or Associates degree in business management or related field preferred.",
IT Project Manager (Remote),Full-time,amIT Global Solutions Pvt Ltd,"Rp. 9,000,000 - Rp. 11,000,000 a month",,
Content Marketing Internship (Remote) (English Speaking),Full-time / Internship,The Swim Starter,"Rp. 1,500,000 - Rp. 2,500,000 a month","Kualifikasi:

Percaya diri dan nyaman tampil di depan kamera
Tertarik dengan tren media sosial dan pemasaran konten
Memiliki keterampilan organisasi yang baik dan perhatian terhadap detail
Bersemangat bekerja di lingkungan yang menyenangkan dan berfokus pada anak-anak
Terbiasa menggunakan alat editing foto/video dasar (misalnya Canva, Capcut)
Keterampilan menulis yang baik untuk caption dan copywriting",
Public relations manager (Remote),Full-time,Algorithmics,"Rp. 7,780,000 a month","Requirements:

Experience in offline marketing.
Deep understanding of the Indonesian market and its specifics.
Creativity and ability to develop unique marketing strategies.
Excellent communication skills and the ability to work in a team.
Ability to analyze campaign results and make necessary adjustments.",
Outreach Representative,Full-time,No Risk Designs,"Rp 6,400,000 - Rp 9,600,000 per Month","Requirements:

Fluency in English, with excellent verbal communication skills
Experience in cold calling or telemarketing, preferably with U.S.-based businesses
Ability to work independently and maintain high energy over prolonged call periods
Basic understanding of CRM software or willingness to learn
Self-motivated, goal-oriented, and comfortable working in a remote environment",
High-Quality Photo Editor Required – Bali-Based,Full-time / Temporary,Bubblegum Casting,"Rp. 3,500,000 - Rp. 6,000,000 a month","Proven experience in photo editing and retouching.
Expertise in Adobe Photoshop, Lightroom, and other editing software.
Strong attention to detail and the ability to produce flawless work.
Excellent time management and organisational skills.
A creative mindset and the ability to adapt to different styles and client needs.
Based in Bali and able to work from our Canggu office 1–2 days per week.
Fluent English (written and spoken) for effective communication.",
